field_name,form_name,section_header,field_type,field_label,select_choices_or_calculations,field_note,text_validation_type_or_show_slider_number,text_validation_min,text_validation_max,identifier,branching_logic,required_field,custom_alignment,question_number,matrix_group_name,matrix_ranking,field_annotation
info_data_date_destroy,data_storage_and_archive,,text,"Date after which stored data can be securely destroyed",,DD-MM-YYYY,date_dmy,,,,"[data_types(1)] = '1'",y,,,,,
samples_what,data_storage_and_archive,"<h4><b><center>BIOLOGICAL SAMPLES </center></b></h4>",notes,"<div class=""rich-text-field-label""><p>What type of biological samples are being stored?</p> <p><em><span style=""font-weight: normal;"">e.g. participant tissue or genetic samples</span></em></p></div>",,,,,,,"[data_types(2)] = '1'",y,,,,,
samples_pers,data_storage_and_archive,,yesno,"<div class=""rich-text-field-label""><p>Are any of the samples connected with personal (identifiable) information?<br /><br /><em><span style=""font-weight: normal;"">Personal information contains details about an identified individual or one who is reasonably identifiable, such as name, phone number, and address.</span></em></p></div>",,,,,,,"[data_types(2)] = '1'",y,RH,,,,
samples_pers_consent,data_storage_and_archive,,descriptive,"<div class=""rich-text-field-label""><div class=""red"" style=""text-align: center;""> <h6 style=""text-align: center;"">If you are storing personal information, you should have specific consent from the individual for it to be held in your data base. The European Union General Data Protection Regulation (GDPR) stipulates this as an absolute requirement and a breach is subject to considerable fines.</h6> <h6 style=""text-align: center;"">For more information go to: bit.ly/2WWk6yJ</h6> </div></div>",,,,,,,"[samples_pers] = '1'",,,,,,
samples_pers_ethics,data_storage_and_archive,,yesno,"Do you have ethics approval to hold this personal (identifiable) information?",,,,,,,"[samples_pers] = '1'",y,RH,,,,
samples_pers_ethics_warn,data_storage_and_archive,,descriptive,"<div class=""red"" style=""text-align:center;""><h6 style=""text-align:center;"">If you are holding any personal information for patients/participants you must have specific ethics approval for the collection and storage of personal information.</h6></div>",,,,,,,"[samples_pers_ethics] = '0'",,,,,,
samples_premises,data_storage_and_archive,,yesno,"<div class=""rich-text-field-label""><p>Do you intend to store the samples on Florey premises?</p></div>",,,,,,,"[data_types(2)] = '1'",y,RH,,,,
samples_premises_where,data_storage_and_archive,,notes,"<div class=""rich-text-field-label""><p>Where will these samples be physically stored?</p> <p><em><span style=""font-weight: normal;"">Please list addresses of ALL storage locations used and include: street address, building, level, room, freezer number etc</span></em></p></div>",,,,,,,[samples_premises]='1',y,,,,,
samples_date_remove,data_storage_and_archive,,text,"Approximate date the samples will be removed from Florey premises",,DD-MM-YYYY,date_dmy,,,,"[samples_premises] = '1'",y,,,,,
samples_third,data_storage_and_archive,,yesno,"Do you intend to store the samples with a third party?",,,,,,,"[data_types(2)] = '1'",y,RH,,,,
samples_third_name,data_storage_and_archive,,text,"What is the name of the third party?",,,,,,,"[samples_third] ='1'",y,,,,,
samples_third_where,data_storage_and_archive,,notes,"<div class=""rich-text-field-label""><p>What is the address where the samples will be physically stored?</p></div>",,,,,,,"[samples_third] = '1'",y,,,,,
samples_third_agree,data_storage_and_archive,,yesno,"Is there a services agreement in place with the third party?",,,,,,,"[samples_third] = '1'",y,RH,,,,
samples_third_agree_warn,data_storage_and_archive,,descriptive,"<div class=""rich-text-field-label""><div class=""red"" style=""text-align: center;""> <h6 style=""text-align: center;"">You must have an agreement in place prior to samples being sent to the third party. Please check with <a href=""mailto:legal@florey.edu.au"" target=""_blank"" rel=""noopener"">legal@florey.edu.au</a> for further information.</h6> </div></div>",,,,,,,"[samples_third_agree] = '0'",,,,,,
samples_date_destroy,data_storage_and_archive,,text,"Date after which the samples can be securely destroyed",,DD-MM-YYYY,date_dmy,,,,"[data_types(2)] = '1'",y,,,,,
images_what,data_storage_and_archive,<h4><b><center>IMAGES</center></b></h4>,notes,"<div class=""rich-text-field-label""><p>What type of images are being stored?</p> <p><em><span style=""font-weight: normal;"">e.g. MRIs, PET scans</span></em></p></div>",,,,,,,"[data_types(3)] = '1'",y,,,,,
images_pers,data_storage_and_archive,,yesno,"<div class=""rich-text-field-label""><p>Are any of the images connected with personal (identifiable) information?<br /><br /><em><span style=""font-weight: normal;"">Personal information contains details about an identified individual or one who is reasonably identifiable, such as name, phone number, and address.</span></em></p></div>",,,,,,,"[data_types(3)] = '1'",y,RH,,,,
images_pers_consent,data_storage_and_archive,,descriptive,"<div class=""rich-text-field-label""><div class=""red"" style=""text-align: center;""> <h6 style=""text-align: center;"">If you are storing personal information, you should have specific consent from the individual for it to be held in your data base. The European Union General Data Protection Regulation (GDPR) stipulates this as an absolute requirement and a breach is subject to considerable fines.</h6> <h6 style=""text-align: center;"">For more information go to: bit.ly/2WWk6yJ</h6> </div></div>",,,,,,,"[images_pers] = '1'",,,,,,
images_pers_ethics,data_storage_and_archive,,yesno,"Do you have ethics approval to hold this personal (identifiable) information?",,,,,,,"[images_pers] = '1'",y,RH,,,,
images_pers_ethics_warn,data_storage_and_archive,,descriptive,"<div class=""red"" style=""text-align:center;""><h6 style=""text-align:center;"">If you are holding any personal information for patients/participants you must have specific ethics approval for the collection and storage of personal information.</h6></div>",,,,,,,"[images_pers_ethics] = '0'",,,,,,
images_premises,data_storage_and_archive,,yesno,"<div class=""rich-text-field-label""><p>Do you intend to store the images on Florey servers/premises?</p></div>",,,,,,,"[data_types(3)] = '1'",y,RH,,,,
images_premises_where,data_storage_and_archive,,notes,"<div class=""rich-text-field-label""><p>Where will these images be physically stored?</p> <p><em><span style=""font-weight: normal;"">Please list addresses of ALL storage locations used and include: street address, building, level, room, freezer number etc</span></em></p></div>",,,,,,,[images_premises]='1',y,,,,,
images_date_remove,data_storage_and_archive,,text,"Approximate date the images will be removed from Florey premises",,DD-MM-YYYY,date_dmy,,,,"[images_premises] = '1'",y,,,,,
images_third,data_storage_and_archive,,yesno,"Do you intend to store the images with a third party?",,,,,,,"[data_types(3)] = '1'",y,RH,,,,
images_third_name,data_storage_and_archive,,text,"What is the name of the third party?",,,,,,,"[images_third] ='1'",y,,,,,
images_third_where,data_storage_and_archive,,notes,"<div class=""rich-text-field-label""><p>What is the address where the images will be physically stored?</p></div>",,,,,,,"[images_third] = '1'",y,,,,,
images_third_agree,data_storage_and_archive,,yesno,"Is there a services agreement in place with the third party?",,,,,,,"[images_third] = '1'",y,RH,,,,
images_third_agree_warn,data_storage_and_archive,,descriptive,"<div class=""rich-text-field-label""><div class=""red"" style=""text-align: center;""> <h6 style=""text-align: center;"">You must have an agreement in place prior to images being sent to the third party. Please check with <a href=""mailto:legal@florey.edu.au"" target=""_blank"" rel=""noopener"">legal@florey.edu.au</a> for further information.</h6> </div></div>",,,,,,,"[images_third_agree] = '0'",,,,,,
images_date_destroy,data_storage_and_archive,,text,"Date after which the images can be securely destroyed",,DD-MM-YYYY,date_dmy,,,,"[data_types(3)] = '1'",y,,,,,
data_contacts,data_storage_and_archive,"<h4><b><center>CONTACTS </center></b></h4>",descriptive,"<div class=""rich-text-field-label""><table style=""border-collapse: collapse; width: 100%; border-style: hidden; height: 86px;"" border=""0""> <tbody> <tr style=""height: 18px;""> <td style=""height: 86px; width: 66.9024%;"" rowspan=""6"">In additional to the Principal Investigator, please confirm which of the following contacts is responsible for the ongoing storage of the data base(s), samples, images, etc.</td> <td style=""width: 33.0859%; height: 18px;"">{hidden_contact_1}</td> </tr> <tr style=""height: 17px;""> <td style=""width: 33.0859%; height: 17px;"">{hidden_contact_2}</td> </tr> <tr style=""height: 17px;""> <td style=""width: 33.0859%; height: 17px;"">{hidden_contact_3}</td> </tr> <tr style=""height: 17px;""> <td style=""width: 33.0859%; height: 17px;"">{hidden_contact_4}</td> </tr> <tr style=""height: 17px;""> <td style=""width: 33.0859%; height: 17px;"">{hidden_contact_5}</td> </tr> <tr> <td style=""width: 33.0859%;"">{hidden_contact_other}</td> </tr> </tbody> </table> <p> </p></div>",,,,,,,,,,,,,
hidden_contact_1,data_storage_and_archive,,checkbox,"Contact 1","1, [study_details_arm_1][contact_name_1]",,,,,,[study_details_arm_1][contact_status_1]='1',,,,,,
hidden_contact_2,data_storage_and_archive,,checkbox,"Contact 2","1, [study_details_arm_1][contact_name_2]",,,,,,[study_details_arm_1][contact_status_2]='1',,,,,,
hidden_contact_3,data_storage_and_archive,,checkbox,"Contact 3","1, [study_details_arm_1][contact_name_3]",,,,,,[study_details_arm_1][contact_status_3]='1',,,,,,
hidden_contact_4,data_storage_and_archive,,checkbox,"Contact 4","1, [study_details_arm_1][contact_name_4]",,,,,,[study_details_arm_1][contact_status_4]='1',,,,,,
hidden_contact_5,data_storage_and_archive,,checkbox,"Contact 5","1, [study_details_arm_1][contact_name_5]",,,,,,[study_details_arm_1][contact_status_5]='1',,,,,,
hidden_contact_other,data_storage_and_archive,,checkbox,"Other contact","1, Someone else not mentioned here",,,,,,,,,,,,
additional_contacts_2,data_storage_and_archive,,descriptive,"<div class=""rich-text-field-label""><table style=""border-collapse: collapse; width: 100.995%; height: 236px; border-color: #000000; border-style: solid;"" border=""0""> <tbody> <tr style=""height: 66px;""> <td style=""text-align: center; height: 66px; width: 57.7149%;"" colspan=""3""> <p style=""text-align: left;"">Additional contacts</p> <p style=""text-align: left;""><span style=""font-weight: normal; color: #000000;"">*Please provide at least one</span></p> </td> </tr> <tr style=""height: 17px; border-color: #ced4d9; border-style: ridge;""> <td style=""height: 34px; width: 10.6104%; border-color: #000000; border-style: none;"">Contact 1<span style=""font-weight: normal;"">*</span></td> <td style=""width: 20.6908%; height: 34px; border-style: none;""> <p><span style=""font-weight: normal;"">Name: {contact_name_6}</span></p> <p><span style=""font-weight: normal;"">Role: {contact_role_6}</span></p> <p><span style=""font-weight: normal;"">{contact_status_6}</span></p> </td> <td style=""width: 26.4137%; height: 34px; border-style: none;""> <p><span style=""font-weight: normal;"">Email: {contact_email_6}</span></p> <p><span style=""font-weight: normal;"">Phone: {contact_phone_6}</span></p> <p> </p> </td> </tr> <tr style=""height: 17px; border-color: #ced4d9; border-style: ridge;""> <td style=""height: 34px; width: 10.6104%; border-color: #000000; border-style: none;"">Contact 2</td> <td style=""width: 20.6908%; height: 34px; border-style: none;""> <p><span style=""font-weight: normal;"">Name: {contact_name_7}</span></p> <p><span style=""font-weight: normal;"">Role: {contact_role_7}</span></p> <p><span style=""font-weight: normal;"">{contact_status_7}</span></p> </td> <td style=""width: 26.4137%; height: 34px; border-style: none;""> <p><span style=""font-weight: normal;"">Email: {contact_email_7}</span></p> <p><span style=""font-weight: normal;"">Phone: {contact_phone_7}</span></p> <p> </p> </td> </tr> </tbody> </table></div>",,,,,,,[hidden_contact_other(1)]='1',,,,,,
contact_name_6,data_storage_and_archive,,text,"Name of additional study contact",,,,,,,,y,,,,,
contact_email_6,data_storage_and_archive,,text,"Email address of additional study contact",,,email,,,,,y,,,,,
contact_phone_6,data_storage_and_archive,,text,"Contact number of additional study contact",,,,,,,,y,,,,,
contact_role_6,data_storage_and_archive,,text,"Role of additional study contact?",,,,,,,,y,RH,,,,
contact_status_6,data_storage_and_archive,,radio,"Is this contact still active?","1, Active contact | 0, Inactive",,,,,,,y,RH,,,,
contact_name_7,data_storage_and_archive,,text,"Name of additional study contact",,,,,,,,,,,,,
contact_email_7,data_storage_and_archive,,text,"Email address of additional study contact",,,email,,,,,,,,,,
contact_phone_7,data_storage_and_archive,,text,"Contact number of additional study contact",,,,,,,,,,,,,
contact_role_7,data_storage_and_archive,,text,"Role of additional study contact?",,,,,,,,y,RH,,,,
contact_status_7,data_storage_and_archive,,radio,"Is this contact still active?","1, Active contact | 0, Inactive",,,,,,,,RH,,,,
data_contact_warning,data_storage_and_archive,,descriptive,"<div class=""red"" style=""text-align:center;""><h6 style=""text-align:center;"">You must list at least one active contact</h6></div>",,,,,,,"[hidden_contact_1(1)]<>'1' and [hidden_contact_2(1)]<>'1' and [hidden_contact_3(1)]<>'1' and [hidden_contact_4(1)]<>'1' and [hidden_contact_5(1)]<>'1' and [contact_status_6]<>'1' and [contact_status_7]<>'1'",,,,,,
cgc_role,cgc_review,"<h4><b><center>Mapping Meeting / Preliminary Approval</center></b></h4>",yesno,"Confirmation of Florey role in the study?",,,,,,,,,RH,,,,
cgc_participants,cgc_review,,yesno,"Confirmation of where participants are sourced from?",,,,,,,,,RH,,,,
cgc_affiliation,cgc_review,,yesno,"PI has Florey Affiliation?",,,,,,,,,RH,,,,
staff_affiliations,cgc_review,,yesno,"All individuals involved in the study have a formal relationship with the Florey or an agreed partner?",,,,,,,,,RH,,,,
cgc_coi,cgc_review,,yesno,"Conflicts of interest declared?",,,,,,,,,RH,,,,
cgc_ethics,cgc_review,,radio,"Ethics approval of study?","1, Yes | 0, No | 2, Pending",,,,,,,,,,,,
cgc_scope,cgc_review,,radio,"Scope of study","1, Single site | 2, Multisite, Australia | 3, Multisite, International",,,,,,,,,,,,
cgc_funding,cgc_review,,yesno,"Confirmation of funding source?",,,,,,,,,RH,,,,
cgc_risk,cgc_review,,yesno,"Risk assessment form complete?",,,,,,,,,RH,,,,
cgc_insurance,cgc_review,,radio,"Relevant insurance in place?","1, Yes | 0, No | 2, Under negotiation",,,,,,,,,,,,
cgc_dsmc,cgc_review,,radio,"Data Safety Monitoring process in place? (if required)","1, Yes | 2, No | 3, Not required | 4, Pending",,,,,,[role]<>'0',,,,,,
cgc_data,cgc_review,,yesno,"Data to be held at Florey?",,,,,,,,,RH,,,,
cgc_capacity,cgc_review,,yesno,"Florey have capacity to support the project?",,,,,,,,,RH,,,,
cgc_agreement_table,cgc_review,,descriptive,"<div class=""rich-text-field-label""><p>Recommended agreements:</p> <table style=""border-collapse: collapse; width: 71.8118%; height: 248.611px;"" border=""1""> <tbody> <tr style=""height: 24.8611px;""> <td style=""width: 61.4292%; height: 24.8611px;""> </td> <td style=""width: 19.8019%; text-align: center; height: 24.8611px;"">In Place</td> <td style=""width: 18.7934%; text-align: center; height: 24.8611px;"">Needed</td> </tr> <tr style=""height: 24.8611px;""> <td style=""width: 61.4292%; height: 24.8611px;"">Non-Disclosure (Confidentiality) Agreement</td> <td style=""width: 19.8019%; height: 24.8611px;""> </td> <td style=""width: 18.7934%; height: 24.8611px;""> </td> </tr> <tr style=""height: 24.8611px;""> <td style=""width: 61.4292%; height: 24.8611px;"">Collaboration/MACH Agreement</td> <td style=""width: 19.8019%; height: 24.8611px;""> </td> <td style=""width: 18.7934%; height: 24.8611px;""> </td> </tr> <tr style=""height: 24.8611px;""> <td style=""width: 61.4292%; height: 24.8611px;"">Funding Agreement</td> <td style=""width: 19.8019%; height: 24.8611px;""> </td> <td style=""width: 18.7934%; height: 24.8611px;""> </td> </tr> <tr style=""height: 24.8611px;""> <td style=""width: 61.4292%; height: 24.8611px;"">Data Transfer Agreement</td> <td style=""width: 19.8019%; height: 24.8611px;""> </td> <td style=""width: 18.7934%; height: 24.8611px;""> </td> </tr> <tr style=""height: 24.8611px;""> <td style=""width: 61.4292%; height: 24.8611px;"">Indemnity Agreement</td> <td style=""width: 19.8019%; height: 24.8611px;""> </td> <td style=""width: 18.7934%; height: 24.8611px;""> </td> </tr> <tr style=""height: 24.8611px;""> <td style=""width: 61.4292%; height: 24.8611px;"">Services Agreement</td> <td style=""width: 19.8019%; height: 24.8611px;""> </td> <td style=""width: 18.7934%; height: 24.8611px;""> </td> </tr> <tr style=""height: 24.8611px;""> <td style=""width: 61.4292%; height: 24.8611px;"">Clinical Trial Research Agreement (CTRA)</td> <td style=""width: 19.8019%; height: 24.8611px;""> </td> <td style=""width: 18.7934%; height: 24.8611px;""> </td> </tr> <tr style=""height: 24.8611px;""> <td style=""width: 61.4292%; height: 24.8611px;"">Licensing Agreement</td> <td style=""width: 19.8019%; height: 24.8611px;""> </td> <td style=""width: 18.7934%; height: 24.8611px;""> </td> </tr> <tr style=""height: 24.8611px;""> <td style=""width: 61.4292%; height: 24.8611px;"">Commercial Agreement</td> <td style=""width: 19.8019%; height: 24.8611px;""> </td> <td style=""width: 18.7934%; height: 24.8611px;""> </td> </tr> <tr> <td style=""width: 61.4292%;"">Other</td> <td style=""width: 19.8019%;""> </td> <td style=""width: 18.7934%;""> </td> </tr> <tr> <td style=""width: 61.4292%;"">None</td> <td style=""width: 19.8019%;""> </td> <td style=""width: 18.7934%;""> </td> </tr> </tbody> </table> <p> </p></div>",,,,,,,,,,,,,
agreements_future,cgc_review,,checkbox,"Which of the following additional agreements do you believe you will need for your research? (If any)","1, Non-Disclosure (Confidentiality) Agreement | 2, Collaboration/MACH Agreement | 3, Funding Agreement | 4, Data Transfer Agreement | 5, Indemnity Agreement | 6, Services Agreement | 7, Clinical Trial Research Agreement (CTRA) | 8, Licensing Agreement | 9, Commercial Agreement | 10, Other | 11, None - All my agreements are already in place/I don't need any further agreements",,,,,,,y,,,,,@NONEOFTHEABOVE=11
agreements_other,cgc_review,,text,"Please describe the type of agreement",,,,,,,[agreements_future(10)]='1',,,,,,
cgc_review,cgc_review,<h4><b><center>APPROVAL</center></b></h4>,radio,"CGC have reviewed and approved this study to proceed","1, Yes | 0, No | 2, Pending",,,,,,,y,RH,,,,
cgc_review_num,cgc_review,,text,"Approval number:",,,,,,,,y,,,,,
cgc_review_date,cgc_review,,text,"Date of approval",,,date_dmy,,,,[cgc_review]='1',y,,,,,
responsibilities_sent_s,cgc_review,,yesno,"<div class=""rich-text-field-label""><p>Investigator Responsibilities document sent to Principal Investigator</p></div>",,,,,,,,y,RH,,,,
responsibilities_upload_s,cgc_review,,file,"<div class=""rich-text-field-label""><p>Please upload a signed copy of the Investigator Responsibilities document</p></div>",,,,,,,[responsibilities_sent_s]='1',y,,,,,@INLINE
cgc_appr_comment,cgc_review,,notes,Comments,,,,,,,,,RH,,,,
report_requirement,annual_reporting,"<h4><b><center>Annual & Safety Reports</center></b></h4>",descriptive,"<div class='green' style='text-align:center;'><h6 style='text-align:center;'>It is a requirement to provide an annual status update of your study and a final report at the end of your project.</h6></div>",,,,,,,[current-instance]='1',,,,,,
annual_andor_safety,annual_reporting,,checkbox,"What type of report would you like to submit?","1, Annual Report | 2, Safety Report",,,,,,,y,,,,,
annual_report,annual_reporting,,file,"Year [current-instance]: Please upload a copy of the report",,,,,,,,y,,,,,@INLINE
final_report_yn,annual_reporting,,yesno,"Is this the final report for the study?",,,,,,,,y,RH,,,,
acknowledgement_sent,annual_reporting,"<h4><b><center>REPORT ACKNOWLEDGEMENT (CGC use only) </center></b></h4>",yesno,"Acknowledgement letter sent to Principal Investigator?",,,,,,,,y,RH,,,,
acknowledgement_upload,annual_reporting,,file,"<div class=""rich-text-field-label""><p>Please upload a copy of the acknowledgement letter</p></div>",,,,,,,"[acknowledgement_sent] = '1'",,,,,,
reports_instructions,annual_reporting,,descriptive,"<div class=""rich-text-field-label""><p style=""border: 2px solid grey; padding: 2px; text-align: center;""><span style=""display: block; border: 1px solid red; padding: 10px; font- size: 125%; font-style: italic; font-weight: normal;"">To add another report, select the dropdown box from 'current instance' above and select 'Add New'. </span></p></div>",,,,,,,,,,,,,
summary,governance_application,"<center><h4><b>FLOREY SITE SPECIFIC GOVERNANCE SUBMISSION</b></h4></center> <p style=""border: 2px solid grey; padding: 2px; text-align: center;""><span style=""display: block; border: 1px solid red; padding: 10px; font- size: 125%; font-style: italic; font-weight: normal;""> Please complete when Florey is a participating site and site specific governance approval is required. </span></p>",notes,"Please provide a brief summary of the application",,,,,,,,,,,,,
protocol_upload,governance_application,"<div class=""rich-text-field-label""><p>Please upload relevant documents as listed below:</p></div>",file,"Ethics approved protocol",,,,,,,,,,,,,@INLINE
ib_table,governance_application," ",descriptive,"<div class=""rich-text-field-label""><table style=""border-collapse: collapse; width: 100%; height: 49px; border-style: hidden; float: left;"" border=""0""> <tbody> <tr style=""height: 24.5px;""> <td style=""width: 56.1528%; height: 49px;"" rowspan=""3"">Investigator Brochure</td> <td style=""width: 22.9137%;"">Tracked from Master:</td> <td style=""width: 20.9335%; height: 24.5px;"">{ib_upload}</td> </tr> <tr> <td style=""width: 22.9137%;"">Clean:</td> <td style=""width: 20.9335%;"">{ib_upload_clean}</td> </tr> <tr style=""height: 24.5px;""> <td style=""width: 22.9137%;""> </td> <td style=""width: 20.9335%; height: 24.5px;"">{ib_na}</td> </tr> </tbody> </table></div>",,,,,,,,,,,,,
ib_upload,governance_application,,file,"Please upload a copy of the investigator brochure (Tracked from Master)",,,,,,,,,,,,,@INLINE
ib_upload_clean,governance_application,,file,"Please upload a copy of the investigator brochure (Clean)",,,,,,,,,,,,,@INLINE
ib_na,governance_application,,radio,or,"1, Not applicable",,,,,,,,,,,,
tga_table,governance_application," ",descriptive,"<div class=""rich-text-field-label""><table style=""border-collapse: collapse; width: 100%; height: 49px; border-style: hidden; float: left;"" border=""0""> <tbody> <tr style=""height: 24.5px;""> <td style=""width: 59.6887%; height: 49px;"" rowspan=""2""> <p>TGA Notification/Acknowledgement</p> <p><span style=""font-weight: normal;""><em>Only applies if you are using an Investigational Product (IP)</em></span></p> </td> <td style=""width: 40.1718%; height: 24.5px;"">{tga_upload}</td> </tr> <tr style=""height: 24.5px;""> <td style=""width: 40.1718%; height: 24.5px;"">{tga_na}</td> </tr> </tbody> </table></div>",,,,,,,,,,,,,
tga_upload,governance_application,,file,"Please upload a copy of the TGA Notification/Acknowledgement",,,,,,,,,,,,,@INLINE
tga_na,governance_application,,radio,or,"1, Not applicable",,,,,,,,,,,,
letter_upload,governance_application," ",file,"Ethics approval letter, stating Florey as the Participating Site",,,,,,,,,,,,,@INLINE
ctra_signed,governance_application,,radio,"Sponsor signed CTRA submitted","1, Yes | 0, No | 2, Not applicable",,,,,,,,RH,,,,
ctra_instructions,governance_application,,descriptive,"<div class=""green"" style=""text-align:center;""><h6 style=""text-align:center;"">Please upload the signed CTRA in the section titled ""Agreements"" </h6></div>",,,,,,,[ctra_signed]='1',,,,,,
picf_master_upload,governance_application,"<div class=""rich-text-field-label""><p>HREC Approved <span style=""text-decoration: underline;"">Master</span> Forms</p></div>",file,"<div class=""rich-text-field-label""><p><span style=""text-decoration: underline;"">Patient</span> information sheet and consent form</p></div>",,,,,,,,,,,,,@INLINE
pricf_master_upload,governance_application,,file,"<div class=""rich-text-field-label""><p><span style=""text-decoration: underline;"">Person responsible</span> information sheet and consent form</p></div>",,,,,,,,,,,,,@INLINE
parent_master_upload,governance_application,,file,"<div class=""rich-text-field-label""><p><span style=""text-decoration: underline;"">Parent/guardian</span> information sheet and consent form</p></div>",,,,,,,,,,,,,@INLINE
other_master_upload,governance_application,,file,"<div class=""rich-text-field-label""><p><span style=""text-decoration: underline;"">'Other'</span> approved information sheet and consent form</p></div>",,,,,,,,,,,,,@INLINE
